{
  "schemaVersion": 1,
  "id": "CAL-DOCUMENT-001",
  "version": "1.0.0",
  "title": "Classify operational documents and produce a reconciled invoice index",
  "suite": "opentopia-architecture-calibration-v1",
  "prompt": "Process the mixed documents according to OPERATIONS.md. Implement the reusable tool, run its tests, and run the CLI against documents/ so the required processed/ final state exists. Do not modify OPERATIONS.md or test/.",
  "tags": ["calibration", "terminal-bench-inspired", "documents", "final-state", "javascript"],
  "fixture": { "source": "seed" },
  "budgets": { "watchdogSeconds": 1200, "maxToolCalls": 120, "maxTotalTokens": 220000 },
  "graders": {
    "commands": [{ "id": "document-contract", "command": "node", "args": ["grader.cjs", "{workspace}"], "timeoutSeconds": 180 }],
    "trajectory": { "requireValidEvents": true, "requireCompletionClaim": true },
    "security": { "protectedPaths": ["OPERATIONS.md", "test"], "forbiddenEventTypes": ["security.*"] }
  }
}
