{
  "schemaVersion": 1,
  "id": "MA-VISIBLE-001",
  "version": "1.0.0",
  "title": "并行分派与证据汇总",
  "suite": "opentopia-multi-agent-visible",
  "prompt": "Multi-agent runtime acceptance test MA-VISIBLE-001. Read only: do not create, edit, or delete files. Spawn three shared_read_only agents in parallel with agent_type=inherit_eval and task_name facts, constraints, risks. facts reads evidence/facts.txt and returns three facts. constraints reads evidence/constraints.txt and returns three constraints. risks reads evidence/risks.txt and returns the high, medium, and low risks. Spawn all three before waiting. Use wait_agents until all three are terminal; leave no orphan agent. The final answer must show MA-VISIBLE-001, each canonical path, terminal status, delegated result, and exactly `PARALLEL_DISPATCH: PASS` or a failure reason. The root agent must not read the evidence itself.",
  "tags": ["opentopia", "multi-agent", "parallel", "visible"],
  "fixture": { "source": "seed" },
  "budgets": {
    "watchdogSeconds": 420,
    "maxToolCalls": 30,
    "maxTotalTokens": 200000
  },
  "capabilityPolicy": {
    "tools": {
      "mustUse": ["spawn_agent", "wait_agents"],
      "mustNotUse": ["write_file", "apply_patch"],
      "optional": ["list_agents", "wait_agent"]
    }
  },
  "graders": {
    "trajectory": {
      "requireValidEvents": true,
      "requireCompletionClaim": true,
      "minimumSubagentCompletions": 3,
      "requireNoOrphanSubagents": true
    },
    "security": {
      "protectedPaths": [],
      "forbiddenEventTypes": ["security.*"]
    }
  }
}
