{
  "schemaVersion": 1,
  "id": "MA-VISIBLE-003",
  "version": "1.0.0",
  "title": "同一 Agent 后续任务复用",
  "suite": "opentopia-multi-agent-visible",
  "prompt": "Multi-agent follow-up reuse acceptance test MA-VISIBLE-003. Read only: do not create, edit, or delete files. Spawn exactly one shared_read_only agent with agent_type=inherit_eval and task_name=auditor. It reads evidence/checklist.txt and returns PASS or FAIL for every item with one evidence sentence. Wait for completion and record its canonical path. Then call followup_task on that completed auditor with: `Keep the same identity, recheck the first conclusion, correct contradictions, and output FINAL_VERDICT.` Wait for the second terminal result. Do not create a second agent. The final answer must show MA-VISIBLE-003, both paths, both statuses, whether the path stayed identical, the verdict, and exactly `AGENT_REUSE: PASS` or a failure reason. Leave no running agent.",
  "tags": ["opentopia", "multi-agent", "followup", "reuse", "visible"],
  "fixture": { "source": "seed" },
  "budgets": {
    "watchdogSeconds": 420,
    "maxToolCalls": 24,
    "maxTotalTokens": 250000
  },
  "capabilityPolicy": {
    "tools": {
      "mustUse": ["spawn_agent", "wait_agent", "followup_task"],
      "mustNotUse": ["write_file", "apply_patch"],
      "optional": ["list_agents"]
    }
  },
  "graders": {
    "trajectory": {
      "requireValidEvents": true,
      "requireCompletionClaim": true,
      "minimumSubagentCompletions": 2,
      "requireNoOrphanSubagents": true
    },
    "security": {
      "protectedPaths": [],
      "forbiddenEventTypes": ["security.*"]
    }
  }
}
